{
  "agent_id": "L1-inception-requirements-extractor-evaluator",
  "agent_version": "1.0.0",
  "execution_id": "exec-b2c3d4e5-f6a7-8901-bcde-f12345678901",
  "workflow_execution_id": "wf-f1e2d3c4-b5a6-7890-fedc-ba0987654321",
  "status": "success",
  "content": {
    "type": "prd_evaluation",
    "schema_version": "1.0",
    "items": {
      "verdict": "pass",
      "scores": {
        "faithfulness": 0.94,
        "hallucination": 0.03,
        "consistency": 0.92,
        "relevance": 0.88,
        "completeness": 0.86,
        "citation_quality": 0.96
      },
      "scores_are": "post-fix (after applying corrections)",
      "findings": [
        {
          "category": "relevance",
          "description": "NFR-02 'system should be scalable' is not measurable",
          "fix_applied": "Changed to 'System shall support 500k concurrent users with < 500ms p95 response time'"
        },
        {
          "category": "completeness",
          "description": "No success metrics extracted despite 'earn points' and '500k users' being measurable targets",
          "fix_applied": "Added SM-01 'Points accrual rate' and SM-02 'Concurrent user capacity' to PRD section 15"
        },
        {
          "category": "completeness",
          "description": "No risks extracted despite PCI-DSS compliance and vendor integration being risk factors",
          "fix_applied": "Added RSK-01 'PCI-DSS audit failure' and RSK-02 'Core banking API integration delay' to PRD section 16"
        }
      ],
      "artifact": {
        "type": "prd_document",
        "format": "markdown",
        "location": "https://storageaccount.blob.core.windows.net/agent-outputs/wf-f1e2d3c4-b5a6-7890-fedc-ba0987654321/prd/prd-rewardconnect.md",
        "status": "corrected_and_reuploaded"
      }
    },
    "execution_summary": "• Verdict: pass\n• Scores: faithfulness 0.94, hallucination 0.03, consistency 0.92, relevance 0.88, completeness 0.86, citation 0.96\n• 3 findings, 3 fixes applied, 0 unfixable\n• Artifact re-uploaded\n• KBs: kb-L1-inception-requirements-extractor-evaluation (scoring thresholds, quality gates)\n• Tools: tool-L1-azure-blob-reader (success), tool-L1-azure-blob-writer (success)"
  }
}
